book,chapter,verse,text
luke,7,15,και ανεκαθισεν ο νεκρος και ηρξατο λαλειν και εδωκεν αυτον τη μητρι αυτου
luke,7,16,ελαβεν δε φοβος απαντας και εδοξαζον τον θεον λεγοντες οτι προφητης μεγας εγηγερται εν ημιν και οτι επεσκεψατο ο θεος τον λαον αυτου
luke,7,17,και εξηλθεν ο λογος ουτος εν ολη τη ιουδαια περι αυτου και εν παση τη περιχωρω
luke,7,18,και απηγγειλαν ιωαννη οι μαθηται αυτου περι παντων τουτων
luke,7,19,και προσκαλεσαμενος δυο τινας των μαθητων αυτου ο ιωαννης επεμψεν προς τον ιησουν λεγων συ ει ο ερχομενος η αλλον προσδοκωμεν
luke,7,20,παραγενομενοι δε προς αυτον οι ανδρες ειπον ιωαννης ο βαπτιστης απεσταλκεν ημας προς σε λεγων συ ει ο ερχομενος η αλλον προσδοκωμεν
luke,7,21,εν αυτη δε τη ωρα εθεραπευσεν πολλους απο νοσων και μαστιγων και πνευματων πονηρων και τυφλοις πολλοις εχαρισατο το βλεπειν
luke,7,22,και αποκριθεις ο ιησους ειπεν αυτοις πορευθεντες απαγγειλατε ιωαννη α ειδετε και ηκουσατε οτι τυφλοι αναβλεπουσιν χωλοι περιπατουσιν λεπροι καθαριζονται κωφοι ακουουσιν νεκροι εγειρονται πτωχοι ευαγγελιζονται
luke,7,23,και μακαριος εστιν ος εαν μη σκανδαλισθη εν εμοι
luke,7,24,απελθοντων δε των αγγελων ιωαννου ηρξατο λεγειν προς τους οχλους περι ιωαννου τι εξεληλυθατε εις την ερημον θεασασθαι καλαμον υπο ανεμου σαλευομενον
luke,7,25,αλλα τι εξεληλυθατε ιδειν ανθρωπον εν μαλακοις ιματιοις ημφιεσμενον ιδου οι εν ιματισμω ενδοξω και τρυφη υπαρχοντες εν τοις βασιλειοις εισιν
luke,7,26,αλλα τι εξεληλυθατε ιδειν προφητην ναι λεγω υμιν και περισσοτερον προφητου
luke,7,27,ουτος εστιν περι ου γεγραπται ιδου εγω αποστελλω τον αγγελον μου προ προσωπου σου ος κατασκευασει την οδον σου εμπροσθεν σου
luke,7,28,λεγω γαρ υμιν μειζων εν γεννητοις γυναικων προφητης ιωαννου του βαπτιστου ουδεις εστιν ο δε μικροτερος εν τη βασιλεια του θεου μειζων αυτου εστιν
luke,7,29,και πας ο λαος ακουσας και οι τελωναι εδικαιωσαν τον θεον βαπτισθεντες το βαπτισμα ιωαννου
luke,7,30,οι δε φαρισαιοι και οι νομικοι την βουλην του θεου ηθετησαν εις εαυτους μη βαπτισθεντες υπ αυτου
luke,7,31,ειπεν δε ο κυριος τινι ουν ομοιωσω τους ανθρωπους της γενεας ταυτης και τινι εισιν ομοιοι
luke,7,32,ομοιοι εισιν παιδιοις τοις εν αγορα καθημενοις και προσφωνουσιν αλληλοις και λεγουσιν ηυλησαμεν υμιν και ουκ ωρχησασθε εθρηνησαμεν υμιν και ουκ εκλαυσατε
luke,7,33,εληλυθεν γαρ ιωαννης ο βαπτιστης μητε αρτον εσθιων μητε οινον πινων και λεγετε δαιμονιον εχει
luke,7,34,εληλυθεν ο υιος του ανθρωπου εσθιων και πινων και λεγετε ιδου ανθρωπος φαγος και οινοποτης τελωνων φιλος και αμαρτωλων
luke,7,35,και εδικαιωθη η σοφια απο των τεκνων αυτης παντων
luke,7,36,ηρωτα δε τις αυτον των φαρισαιων ινα φαγη μετ αυτου και εισελθων εις την οικιαν του φαρισαιου ανεκλιθη
luke,7,37,και ιδου γυνη εν τη πολει ητις ην αμαρτωλος επιγνουσα οτι ανακειται εν τη οικια του φαρισαιου κομισασα αλαβαστρον μυρου
luke,7,38,και στασα παρα τους ποδας αυτου οπισω κλαιουσα ηρξατο βρεχειν τους ποδας αυτου τοις δακρυσιν και ταις θριξιν της κεφαλης αυτης εξεμασσεν και κατεφιλει τους ποδας αυτου και ηλειφεν τω μυρω
luke,7,39,ιδων δε ο φαρισαιος ο καλεσας αυτον ειπεν εν εαυτω λεγων ουτος ει ην προφητης εγινωσκεν αν τις και ποταπη η γυνη ητις απτεται αυτου οτι αμαρτωλος εστιν
luke,7,40,και αποκριθεις ο ιησους ειπεν προς αυτον σιμων εχω σοι τι ειπειν ο δε φησιν διδασκαλε ειπε
luke,7,41,δυο χρεωφειλεται ησαν δανειστη τινι ο εις ωφειλεν δηναρια πεντακοσια ο δε ετερος πεντηκοντα
luke,7,42,μη εχοντων δε αυτων αποδουναι αμφοτεροις εχαρισατο τις ουν αυτων ειπε πλειον αυτον αγαπησει
luke,7,43,αποκριθεις δε ο σιμων ειπεν υπολαμβανω οτι ω το πλειον εχαρισατο ο δε ειπεν αυτω ορθως εκρινας
luke,7,44,και στραφεις προς την γυναικα τω σιμωνι εφη βλεπεις ταυτην την γυναικα εισηλθον σου εις την οικιαν υδωρ επι τους ποδας μου ουκ εδωκας αυτη δε τοις δακρυσιν εβρεξεν μου τους ποδας και ταις θριξιν της κεφαλης αυτης εξεμαξεν
luke,7,45,φιλημα μοι ουκ εδωκας αυτη δε αφ ης εισηλθον ου διελιπεν καταφιλουσα μου τους ποδας
luke,7,46,ελαιω την κεφαλην μου ουκ ηλειψας αυτη δε μυρω ηλειψεν μου τους ποδας
luke,7,47,ου χαριν λεγω σοι αφεωνται αι αμαρτιαι αυτης αι πολλαι οτι ηγαπησεν πολυ ω δε ολιγον αφιεται ολιγον αγαπα
luke,7,48,ειπεν δε αυτη αφεωνται σου αι αμαρτιαι
luke,7,49,και ηρξαντο οι συνανακειμενοι λεγειν εν εαυτοις τις ουτος εστιν ος και αμαρτιας αφιησιν
luke,7,50,ειπεν δε προς την γυναικα η πιστις σου σεσωκεν σε πορευου εις ειρηνην
luke,8,1,και εγενετο εν τω καθεξης και αυτος διωδευεν κατα πολιν και κωμην κηρυσσων και ευαγγελιζομενος την βασιλειαν του θεου και οι δωδεκα συν αυτω
luke,8,2,και γυναικες τινες αι ησαν τεθεραπευμεναι απο πνευματων πονηρων και ασθενειων μαρια η καλουμενη μαγδαληνη αφ ης δαιμονια επτα εξεληλυθει
luke,8,3,και ιωαννα γυνη χουζα επιτροπου ηρωδου και σουσαννα και ετεραι πολλαι αιτινες διηκονουν αυτω απο των υπαρχοντων αυταις
luke,8,4,συνιοντος δε οχλου πολλου και των κατα πολιν επιπορευομενων προς αυτον ειπεν δια παραβολης
luke,8,5,εξηλθεν ο σπειρων του σπειραι τον σπορον αυτου και εν τω σπειρειν αυτον ο μεν επεσεν παρα την οδον και κατεπατηθη και τα πετεινα του ουρανου κατεφαγεν αυτο
luke,8,6,και ετερον επεσεν επι την πετραν και φυεν εξηρανθη δια το μη εχειν ικμαδα
luke,8,7,και ετερον επεσεν εν μεσω των ακανθων και συμφυεισαι αι ακανθαι απεπνιξαν αυτο
luke,8,8,και ετερον επεσεν επι την γην την αγαθην και φυεν εποιησεν καρπον εκατονταπλασιονα ταυτα λεγων εφωνει ο εχων ωτα ακουειν ακουετω
luke,8,9,επηρωτων δε αυτον οι μαθηται αυτου λεγοντες τις ειη η παραβολη αυτη
luke,8,10,ο δε ειπεν υμιν δεδοται γνωναι τα μυστηρια της βασιλειας του θεου τοις δε λοιποις εν παραβολαις ινα βλεποντες μη βλεπωσιν και ακουοντες μη συνιωσιν
luke,8,11,εστιν δε αυτη η παραβολη ο σπορος εστιν ο λογος του θεου
luke,8,12,οι δε παρα την οδον εισιν οι ακουοντες ειτα ερχεται ο διαβολος και αιρει τον λογον απο της καρδιας αυτων ινα μη πιστευσαντες σωθωσιν
luke,8,13,οι δε επι της πετρας οι οταν ακουσωσιν μετα χαρας δεχονται τον λογον και ουτοι ριζαν ουκ εχουσιν οι προς καιρον πιστευουσιν και εν καιρω πειρασμου αφιστανται
luke,8,14,το δε εις τας ακανθας πεσον ουτοι εισιν οι ακουσαντες και υπο μεριμνων και πλουτου και ηδονων του βιου πορευομενοι συμπνιγονται και ου τελεσφορουσιν
luke,8,15,το δε εν τη καλη γη ουτοι εισιν οιτινες εν καρδια καλη και αγαθη ακουσαντες τον λογον κατεχουσιν και καρποφορουσιν εν υπομονη
luke,8,16,ουδεις δε λυχνον αψας καλυπτει αυτον σκευει η υποκατω κλινης τιθησιν αλλ επι λυχνιας επιτιθησιν ινα οι εισπορευομενοι βλεπωσιν το φως
luke,8,17,ου γαρ εστιν κρυπτον ο ου φανερον γενησεται ουδε αποκρυφον ο ου γνωσθησεται και εις φανερον ελθη
luke,8,18,βλεπετε ουν πως ακουετε ος γαρ αν εχη δοθησεται αυτω και ος αν μη εχη και ο δοκει εχειν αρθησεται απ αυτου
luke,8,19,παρεγενοντο δε προς αυτον η μητηρ και οι αδελφοι αυτου και ουκ ηδυναντο συντυχειν αυτω δια τον οχλον
luke,8,20,και απηγγελη αυτω λεγοντων η μητηρ σου και οι αδελφοι σου εστηκασιν εξω ιδειν σε θελοντες
luke,8,21,ο δε αποκριθεις ειπεν προς αυτους μητηρ μου και αδελφοι μου ουτοι εισιν οι τον λογον του θεου ακουοντες και ποιουντες αυτον
luke,8,22,και εγενετο εν μια των ημερων και αυτος ενεβη εις πλοιον και οι μαθηται αυτου και ειπεν προς αυτους διελθωμεν εις το περαν της λιμνης και ανηχθησαν
luke,8,23,πλεοντων δε αυτων αφυπνωσεν και κατεβη λαιλαψ ανεμου εις την λιμνην και συνεπληρουντο και εκινδυνευον
luke,8,24,προσελθοντες δε διηγειραν αυτον λεγοντες επιστατα επιστατα απολλυμεθα ο δε εγερθεις επετιμησεν τω ανεμω και τω κλυδωνι του υδατος και επαυσαντο και εγενετο γαληνη
luke,8,25,ειπεν δε αυτοις που εστιν η πιστις υμων φοβηθεντες δε εθαυμασαν λεγοντες προς αλληλους τις αρα ουτος εστιν οτι και τοις ανεμοις επιτασσει και τω υδατι και υπακουουσιν αυτω
luke,8,26,και κατεπλευσαν εις την χωραν των γαδαρηνων ητις εστιν αντιπεραν της γαλιλαιας
luke,8,27,εξελθοντι δε αυτω επι την γην υπηντησεν αυτω ανηρ τις εκ της πολεως ος ειχεν δαιμονια εκ χρονων ικανων και ιματιον ουκ ενεδιδυσκετο και εν οικια ουκ εμενεν αλλ εν τοις μνημασιν
luke,8,28,ιδων δε τον ιησουν και ανακραξας προσεπεσεν αυτω και φωνη μεγαλη ειπεν τι εμοι και σοι ιησου υιε του θεου του υψιστου δεομαι σου μη με βασανισης
luke,8,29,παρηγγελλεν γαρ τω πνευματι τω ακαθαρτω εξελθειν απο του ανθρωπου πολλοις γαρ χρονοις συνηρπακει αυτον και εδεσμειτο αλυσεσιν και πεδαις φυλασσομενος και διαρρησσων τα δεσμα ηλαυνετο υπο του δαιμονος εις τας ερημους
luke,8,30,επηρωτησεν δε αυτον ο ιησους λεγων τι σοι εστιν ονομα ο δε ειπεν λεγεων οτι δαιμονια πολλα εισηλθεν εις αυτον
luke,8,31,και αυτον ινα μη επιταξη αυτοις εις την αβυσσον απελθειν
luke,8,32,ην δε εκει αγελη χοιρων ικανων βοσκομενων εν τω ορει και παρεκαλουν αυτον ινα επιτρεψη αυτοις εις εκεινους εισελθειν και επετρεψεν αυτοις
luke,8,33,εξελθοντα δε τα δαιμονια απο του ανθρωπου εισηλθεν εις τους χοιρους και ωρμησεν η αγελη κατα του κρημνου εις την λιμνην και απεπνιγη
luke,8,34,ιδοντες δε οι βοσκοντες το γεγενημενον εφυγον και απελθοντες απηγγειλαν εις την πολιν και εις τους αγρους
luke,8,35,εξηλθον δε ιδειν το γεγονος και ηλθον προς τον ιησουν και ευρον καθημενον τον ανθρωπον αφ ου τα δαιμονια εξεληλυθει ιματισμενον και σωφρονουντα παρα τους ποδας του ιησου και εφοβηθησαν
luke,8,36,απηγγειλαν δε αυτοις και οι ιδοντες πως εσωθη ο δαιμονισθεις
luke,8,37,και ηρωτησαν αυτον απαν το πληθος της περιχωρου των γαδαρηνων απελθειν απ αυτων οτι φοβω μεγαλω συνειχοντο αυτος δε εμβας εις το πλοιον υπεστρεψεν
luke,8,38,εδεετο δε αυτου ο ανηρ αφ ου εξεληλυθει τα δαιμονια ειναι συν αυτω απελυσεν δε αυτον ο ιησους λεγων
luke,8,39,υποστρεφε εις τον οικον σου και διηγου οσα εποιησεν σοι ο θεος και απηλθεν καθ ολην την πολιν κηρυσσων οσα εποιησεν αυτω ο ιησους
luke,8,40,εγενετο δε εν τω υποστρεψαι τον ιησουν απεδεξατο αυτον ο οχλος ησαν γαρ παντες προσδοκωντες αυτον
luke,8,41,και ιδου ηλθεν ανηρ ω ονομα ιαειρος και αυτος αρχων της συναγωγης υπηρχεν και πεσων παρα τους ποδας του ιησου παρεκαλει αυτον εισελθειν εις τον οικον αυτου
luke,8,42,οτι θυγατηρ μονογενης ην αυτω ως ετων δωδεκα και αυτη απεθνησκεν εν δε τω υπαγειν αυτον οι οχλοι συνεπνιγον αυτον
luke,8,43,και γυνη ουσα εν ρυσει αιματος απο ετων δωδεκα ητις εις ιατρους προσαναλωσασα ολον τον βιον ουκ ισχυσεν υπ ουδενος θεραπευθηναι
luke,8,44,προσελθουσα οπισθεν ηψατο του κρασπεδου του ιματιου αυτου και παραχρημα εστη η ρυσις του αιματος αυτης
luke,8,45,και ειπεν ο ιησους τις ο αψαμενος μου αρνουμενων δε παντων ειπεν ο πετρος και οι μετ αυτου επιστατα οι οχλοι συνεχουσιν σε και αποθλιβουσιν και λεγεις τις ο αψαμενος μου
luke,8,46,ο δε ιησους ειπεν ηψατο μου τις εγω γαρ εγνων δυναμιν εξελθουσαν απ εμου
luke,8,47,ιδουσα δε η γυνη οτι ουκ ελαθεν τρεμουσα ηλθεν και προσπεσουσα αυτω δι ην αιτιαν ηψατο αυτου απηγγειλεν αυτω ενωπιον παντος του λαου και ως ιαθη παραχρημα
luke,8,48,ο δε ειπεν αυτη θαρσει θυγατερ η πιστις σου σεσωκεν σε πορευου εις ειρηνην
luke,8,49,ετι αυτου λαλουντος ερχεται τις παρα του αρχισυναγωγου λεγων αυτω οτι τεθνηκεν η θυγατηρ σου μη σκυλλε τον διδασκαλον
luke,8,50,ο δε ιησους ακουσας απεκριθη αυτω λεγων μη φοβου μονον πιστευε και σωθησεται
luke,8,51,εισελθων δε εις την οικιαν ουκ αφηκεν εισελθειν ουδενα ει μη πετρον και ιακωβον και ιωαννην και τον πατερα της παιδος και την μητερα
luke,8,52,εκλαιον δε παντες και εκοπτοντο αυτην ο δε ειπεν μη κλαιετε ουκ απεθανεν αλλα καθευδει
luke,8,53,και κατεγελων αυτου ειδοτες οτι απεθανεν
luke,8,54,αυτος δε εκβαλων εξω παντας και κρατησας της χειρος αυτης εφωνησεν λεγων η παις εγειρου
luke,8,55,και επεστρεψεν το πνευμα αυτης και ανεστη παραχρημα και διεταξεν αυτη δοθηναι φαγειν
luke,8,56,και εξεστησαν οι γονεις αυτης ο δε παρηγγειλεν αυτοις μηδενι ειπειν το γεγονος
luke,9,1,συγκαλεσαμενος δε τους δωδεκα μαθητας αυτου εδωκεν αυτοις δυναμιν και εξουσιαν επι παντα τα δαιμονια και νοσους θεραπευειν
luke,9,2,και απεστειλεν αυτους κηρυσσειν την βασιλειαν του θεου και ιασθαι τους ασθενουντας
luke,9,3,και ειπεν προς αυτους μηδεν αιρετε εις την οδον μητε ραβδους μητε πηραν μητε αρτον μητε αργυριον μητε ανα δυο χιτωνας εχειν
luke,9,4,και εις ην αν οικιαν εισελθητε εκει μενετε και εκειθεν εξερχεσθε
luke,9,5,και οσοι αν μη δεξωνται υμας εξερχομενοι απο της πολεως εκεινης και τον κονιορτον απο των ποδων υμων αποτιναξατε εις μαρτυριον επ αυτους
luke,9,6,εξερχομενοι δε διηρχοντο κατα τας κωμας ευαγγελιζομενοι και θεραπευοντες πανταχου
luke,9,7,ηκουσεν δε ηρωδης ο τετραρχης τα γινομενα υπ αυτου παντα και διηπορει δια το λεγεσθαι υπο τινων οτι ιωαννης εγηγερται εκ νεκρων
luke,9,8,υπο τινων δε οτι ηλιας εφανη αλλων δε οτι προφητης εις των αρχαιων ανεστη
luke,9,9,και ειπεν ο ηρωδης ιωαννην εγω απεκεφαλισα τις δε εστιν ουτος περι ου εγω ακουω τοιαυτα και εζητει ιδειν αυτον
luke,9,10,και υποστρεψαντες οι αποστολοι διηγησαντο αυτω οσα εποιησαν και παραλαβων αυτους υπεχωρησεν κατ ιδιαν εις τοπον ερημον πολεως καλουμενης βηθσαιδα
luke,9,11,οι δε οχλοι γνοντες ηκολουθησαν αυτω και δεξαμενος αυτους ελαλει αυτοις περι της βασιλειας του θεου και τους χρειαν εχοντας θεραπειας ιατο
luke,9,12,η δε ημερα ηρξατο κλινειν προσελθοντες δε οι δωδεκα ειπον αυτω απολυσον τον οχλον ινα απελθοντες εις τας κυκλω κωμας και τους αγρους καταλυσωσιν και ευρωσιν επισιτισμον οτι ωδε εν ερημω τοπω εσμεν
luke,9,13,ειπεν δε προς αυτους δοτε αυτοις υμεις φαγειν οι δε ειπον ουκ εισιν ημιν πλειον η πεντε αρτοι και δυο ιχθυες ει μητι πορευθεντες ημεις αγορασωμεν εις παντα τον λαον τουτον βρωματα
luke,9,14,ησαν γαρ ωσει ανδρες πεντακισχιλιοι ειπεν δε προς τους μαθητας αυτου κατακλινατε αυτους κλισιας ανα πεντηκοντα
luke,9,15,και εποιησαν ουτως και ανεκλιναν απαντας
luke,9,16,λαβων δε τους πεντε αρτους και τους δυο ιχθυας αναβλεψας εις τον ουρανον ευλογησεν αυτους και κατεκλασεν και εδιδου τοις μαθηταις παρατιθεναι τω οχλω
luke,9,17,και εφαγον και εχορτασθησαν παντες και ηρθη το περισσευσαν αυτοις κλασματων κοφινοι δωδεκα
luke,9,18,και εγενετο εν τω ειναι αυτον προσευχομενον καταμονας συνησαν αυτω οι μαθηται και επηρωτησεν αυτους λεγων τινα με λεγουσιν οι οχλοι ειναι
luke,9,19,οι δε αποκριθεντες ειπον ιωαννην τον βαπτιστην αλλοι δε ηλιαν αλλοι δε οτι προφητης τις των αρχαιων ανεστη
luke,9,20,ειπεν δε αυτοις υμεις δε τινα με λεγετε ειναι αποκριθεις δε ο πετρος ειπεν τον χριστον του θεου
luke,9,21,ο δε επιτιμησας αυτοις παρηγγειλεν μηδενι ειπειν τουτο
luke,9,22,ειπων οτι δει τον υιον του ανθρωπου πολλα παθειν και αποδοκιμασθηναι απο των πρεσβυτερων και αρχιερεων και γραμματεων και αποκτανθηναι και τη τριτη ημερα εγερθηναι
luke,9,23,ελεγεν δε προς παντας ει τις θελει οπισω μου ελθειν απαρνησασθω εαυτον και αρατω τον σταυρον αυτου καθ ημεραν και ακολουθειτω μοι
luke,9,24,ος γαρ αν θελη την ψυχην αυτου σωσαι απολεσει αυτην ος δ αν απολεση την ψυχην αυτου ενεκεν εμου ουτος σωσει αυτην
luke,9,25,τι γαρ ωφελειται ανθρωπος κερδησας τον κοσμον ολον εαυτον δε απολεσας η ζημιωθεις
luke,9,26,ος γαρ αν επαισχυνθη με και τους εμους λογους τουτον ο υιος του ανθρωπου επαισχυνθησεται οταν ελθη εν τη δοξη αυτου και του πατρος και των αγιων αγγελων
