book,chapter,verse,text
acts-of-the-apostles,10,2,ευσεβης και φοβουμενος τον θεον συν παντι τω οικω αυτου ποιων τε ελεημοσυνας πολλας τω λαω και δεομενος του θεου διαπαντος
acts-of-the-apostles,10,3,ειδεν εν οραματι φανερως ωσει ωραν εννατην της ημερας αγγελον του θεου εισελθοντα προς αυτον και ειποντα αυτω κορνηλιε
acts-of-the-apostles,10,4,ο δε ατενισας αυτω και εμφοβος γενομενος ειπεν τι εστιν κυριε ειπεν δε αυτω αι προσευχαι σου και αι ελεημοσυναι σου ανεβησαν εις μνημοσυνον ενωπιον του θεου
acts-of-the-apostles,10,5,και νυν πεμψον εις ιοππην ανδρας και μεταπεμψαι σιμωνα ος επικαλειται πετρος
acts-of-the-apostles,10,6,ουτος ξενιζεται παρα τινι σιμωνι βυρσει ω εστιν οικια παρα θαλασσαν ουτος λαλησει σοι τι σε δει ποιειν
acts-of-the-apostles,10,7,ως δε απηλθεν ο αγγελος ο λαλων τω κορνηλιω φωνησας δυο των οικετων αυτου και στρατιωτην ευσεβη των προσκαρτερουντων αυτω
acts-of-the-apostles,10,8,και εξηγησαμενος αυτοις απαντα απεστειλεν αυτους εις την ιοππην
acts-of-the-apostles,10,9,τη δε επαυριον οδοιπορουντων εκεινων και τη πολει εγγιζοντων ανεβη πετρος επι το δωμα προσευξασθαι περι ωραν εκτην
acts-of-the-apostles,10,10,εγενετο δε προσπεινος και ηθελεν γευσασθαι παρασκευαζοντων δε εκεινων επεπεσεν επ αυτον εκστασις
acts-of-the-apostles,10,11,και θεωρει τον ουρανον ανεωγμενον και καταβαινον επ αυτον σκευος τι ως οθονην μεγαλην τεσσαρσιν αρχαις δεδεμενον και καθιεμενον επι της γης
acts-of-the-apostles,10,12,εν ω υπηρχεν παντα τα τετραποδα της γης και τα θηρια και τα ερπετα και τα πετεινα του ουρανου
acts-of-the-apostles,10,13,και εγενετο φωνη προς αυτον αναστας πετρε θυσον και φαγε
acts-of-the-apostles,10,14,ο δε πετρος ειπεν μηδαμως κυριε οτι ουδεποτε εφαγον παν κοινον η ακαθαρτον
acts-of-the-apostles,10,15,και φωνη παλιν εκ δευτερου προς αυτον α ο θεος εκαθαρισεν συ μη κοινου
acts-of-the-apostles,10,16,τουτο δε εγενετο επι τρις και παλιν ανεληφθη το σκευος εις τον ουρανον
acts-of-the-apostles,10,17,ως δε εν εαυτω διηπορει ο πετρος τι αν ειη το οραμα ο ειδεν και ιδου οι ανδρες οι απεσταλμενοι απο του κορνηλιου διερωτησαντες την οικιαν σιμωνος επεστησαν επι τον πυλωνα
acts-of-the-apostles,10,18,και φωνησαντες επυνθανοντο ει σιμων ο επικαλουμενος πετρος ενθαδε ξενιζεται
acts-of-the-apostles,10,19,του δε πετρου ενθυμουμενου περι του οραματος ειπεν αυτω το πνευμα ιδου ανδρες τρεις ζητουσιν σε
acts-of-the-apostles,10,20,αλλα αναστας καταβηθι και πορευου συν αυτοις μηδεν διακρινομενος διοτι εγω απεσταλκα αυτους
acts-of-the-apostles,10,21,καταβας δε πετρος προς τους ανδρας τους απεσταλμενους απο του κορνηλιου προς αυτον ειπεν ιδου εγω ειμι ον ζητειτε τις η αιτια δι ην παρεστε
acts-of-the-apostles,10,22,οι δε ειπον κορνηλιος εκατονταρχης ανηρ δικαιος και φοβουμενος τον θεον μαρτυρουμενος τε υπο ολου του εθνους των ιουδαιων εχρηματισθη υπο αγγελου αγιου μεταπεμψασθαι σε εις τον οικον αυτου και ακουσαι ρηματα παρα σου
acts-of-the-apostles,10,23,εισκαλεσαμενος ουν αυτους εξενισεν τη δε επαυριον ο πετρος εξηλθεν συν αυτοις και τινες των αδελφων των απο της ιοππης συνηλθον αυτω
acts-of-the-apostles,10,24,και τη επαυριον εισηλθον εις την καισαρειαν ο δε κορνηλιος ην προσδοκων αυτους συγκαλεσαμενος τους συγγενεις αυτου και τους αναγκαιους φιλους
acts-of-the-apostles,10,25,ως δε εγενετο εισελθειν τον πετρον συναντησας αυτω ο κορνηλιος πεσων επι τους ποδας προσεκυνησεν
acts-of-the-apostles,10,26,ο δε πετρος αυτον ηγειρεν λεγων αναστηθι καγω αυτος ανθρωπος ειμι
acts-of-the-apostles,10,27,και συνομιλων αυτω εισηλθεν και ευρισκει συνεληλυθοτας πολλους
acts-of-the-apostles,10,28,εφη τε προς αυτους υμεις επιστασθε ως αθεμιτον εστιν ανδρι ιουδαιω κολλασθαι η προσερχεσθαι αλλοφυλω και εμοι ο θεος εδειξεν μηδενα κοινον η ακαθαρτον λεγειν ανθρωπον
acts-of-the-apostles,10,29,διο και αναντιρρητως ηλθον μεταπεμφθεις πυνθανομαι ουν τινι λογω μετεπεμψασθε με
acts-of-the-apostles,10,30,και ο κορνηλιος εφη απο τεταρτης ημερας μεχρι ταυτης της ωρας ημην νηστευων και την εννατην ωραν προσευχομενος εν τω οικω μου και ιδου ανηρ εστη ενωπιον μου εν εσθητι λαμπρα
acts-of-the-apostles,10,31,και φησιν κορνηλιε εισηκουσθη σου η προσευχη και αι ελεημοσυναι σου εμνησθησαν ενωπιον του θεου
acts-of-the-apostles,10,32,πεμψον ουν εις ιοππην και μετακαλεσαι σιμωνα ος επικαλειται πετρος ουτος ξενιζεται εν οικια σιμωνος βυρσεως παρα θαλασσαν ος παραγενομενος λαλησει σοι
acts-of-the-apostles,10,33,εξαυτης ουν επεμψα προς σε συ τε καλως εποιησας παραγενομενος νυν ουν παντες ημεις ενωπιον του θεου παρεσμεν ακουσαι παντα τα προστεταγμενα σοι υπο του θεου
acts-of-the-apostles,10,34,ανοιξας δε πετρος το στομα ειπεν επ αληθειας καταλαμβανομαι οτι ουκ εστιν προσωποληπτης ο θεος
acts-of-the-apostles,10,35,αλλ εν παντι εθνει ο φοβουμενος αυτον και εργαζομενος δικαιοσυνην δεκτος αυτω εστιν
acts-of-the-apostles,10,36,τον λογον ον απεστειλεν τοις υιοις ισραηλ ευαγγελιζομενος ειρηνην δια ιησου χριστου ουτος εστιν παντων κυριος
acts-of-the-apostles,10,37,υμεις οιδατε το γενομενον ρημα καθ ολης της ιουδαιας αρξαμενον απο της γαλιλαιας μετα το βαπτισμα ο εκηρυξεν ιωαννης
acts-of-the-apostles,10,38,ιησουν τον απο ναζαρετ ως εχρισεν αυτον ο θεος πνευματι αγιω και δυναμει ος διηλθεν ευεργετων και ιωμενος παντας τους καταδυναστευομενους υπο του διαβολου οτι ο θεος ην μετ αυτου
acts-of-the-apostles,10,39,και ημεις εσμεν μαρτυρες παντων ων εποιησεν εν τε τη χωρα των ιουδαιων και εν ιερουσαλημ ον ανειλον κρεμασαντες επι ξυλου
acts-of-the-apostles,10,40,τουτον ο θεος ηγειρεν τη τριτη ημερα και εδωκεν αυτον εμφανη γενεσθαι
acts-of-the-apostles,10,41,ου παντι τω λαω αλλα μαρτυσιν τοις προκεχειροτονημενοις υπο του θεου ημιν οιτινες συνεφαγομεν και συνεπιομεν αυτω μετα το αναστηναι αυτον εκ νεκρων
acts-of-the-apostles,10,42,και παρηγγειλεν ημιν κηρυξαι τω λαω και διαμαρτυρασθαι οτι αυτος εστιν ο ωρισμενος υπο του θεου κριτης ζωντων και νεκρων
acts-of-the-apostles,10,43,τουτω παντες οι προφηται μαρτυρουσιν αφεσιν αμαρτιων λαβειν δια του ονοματος αυτου παντα τον πιστευοντα εις αυτον
acts-of-the-apostles,10,44,ετι λαλουντος του πετρου τα ρηματα ταυτα επεπεσεν το πνευμα το αγιον επι παντας τους ακουοντας τον λογον
acts-of-the-apostles,10,45,και εξεστησαν οι εκ περιτομης πιστοι οσοι συνηλθον τω πετρω οτι και επι τα εθνη η δωρεα του αγιου πνευματος εκκεχυται
acts-of-the-apostles,10,46,ηκουον γαρ αυτων λαλουντων γλωσσαις και μεγαλυνοντων τον θεον τοτε απεκριθη ο πετρος
acts-of-the-apostles,10,47,μητι το υδωρ κωλυσαι δυναται τις του μη βαπτισθηναι τουτους οιτινες το πνευμα το αγιον ελαβον καθως και ημεις
acts-of-the-apostles,10,48,προσεταξεν τε αυτους βαπτισθηναι εν τω ονοματι του κυριου τοτε ηρωτησαν αυτον επιμειναι ημερας τινας
acts-of-the-apostles,11,1,ηκουσαν δε οι αποστολοι και οι αδελφοι οι οντες κατα την ιουδαιαν οτι και τα εθνη εδεξαντο τον λογον του θεου
acts-of-the-apostles,11,2,και οτε ανεβη πετρος εις ιεροσολυμα διεκρινοντο προς αυτον οι εκ περιτομης
acts-of-the-apostles,11,3,λεγοντες οτι προς ανδρας ακροβυστιαν εχοντας εισηλθες και συνεφαγες αυτοις
acts-of-the-apostles,11,4,αρξαμενος δε ο πετρος εξετιθετο αυτοις καθεξης λεγων
acts-of-the-apostles,11,5,εγω ημην εν πολει ιοππη προσευχομενος και ειδον εν εκστασει οραμα καταβαινον σκευος τι ως οθονην μεγαλην τεσσαρσιν αρχαις καθιεμενην εκ του ουρανου και ηλθεν αχρις εμου
acts-of-the-apostles,11,6,εις ην ατενισας κατενοουν και ειδον τα τετραποδα της γης και τα θηρια και τα ερπετα και τα πετεινα του ουρανου
acts-of-the-apostles,11,7,ηκουσα δε φωνης λεγουσης μοι αναστας πετρε θυσον και φαγε
acts-of-the-apostles,11,8,ειπον δε μηδαμως κυριε οτι παν κοινον η ακαθαρτον ουδεποτε εισηλθεν εις το στομα μου
acts-of-the-apostles,11,9,απεκριθη δε μοι φωνη εκ δευτερου εκ του ουρανου α ο θεος εκαθαρισεν συ μη κοινου
acts-of-the-apostles,11,10,τουτο δε εγενετο επι τρις και παλιν ανεσπασθη απαντα εις τον ουρανον
acts-of-the-apostles,11,11,και ιδου εξαυτης τρεις ανδρες επεστησαν επι την οικιαν εν η ημην απεσταλμενοι απο καισαρειας προς με
acts-of-the-apostles,11,12,ειπεν δε μοι το πνευμα συνελθειν αυτοις μηδεν διακρινομενον ηλθον δε συν εμοι και οι εξ αδελφοι ουτοι και εισηλθομεν εις τον οικον του ανδρος
acts-of-the-apostles,11,13,απηγγειλεν τε ημιν πως ειδεν τον αγγελον εν τω οικω αυτου σταθεντα και ειποντα αυτω αποστειλον εις ιοππην ανδρας και μεταπεμψαι σιμωνα τον επικαλουμενον πετρον
acts-of-the-apostles,11,14,ος λαλησει ρηματα προς σε εν οις σωθηση συ και πας ο οικος σου
acts-of-the-apostles,11,15,εν δε τω αρξασθαι με λαλειν επεπεσεν το πνευμα το αγιον επ αυτους ωσπερ και εφ ημας εν αρχη
acts-of-the-apostles,11,16,εμνησθην δε του ρηματος κυριου ως ελεγεν ιωαννης μεν εβαπτισεν υδατι υμεις δε βαπτισθησεσθε εν πνευματι αγιω
acts-of-the-apostles,11,17,ει ουν την ισην δωρεαν εδωκεν αυτοις ο θεος ως και ημιν πιστευσασιν επι τον κυριον ιησουν χριστον εγω δε τις ημην δυνατος κωλυσαι τον θεον
acts-of-the-apostles,11,18,ακουσαντες δε ταυτα ησυχασαν και εδοξαζον τον θεον λεγοντες αραγε και τοις εθνεσιν ο θεος την μετανοιαν εδωκεν εις ζωην
acts-of-the-apostles,11,19,οι μεν ουν διασπαρεντες απο της θλιψεως της γενομενης επι στεφανω διηλθον εως φοινικης και κυπρου και αντιοχειας μηδενι λαλουντες τον λογον ει μη μονον ιουδαιοις
acts-of-the-apostles,11,20,ησαν δε τινες εξ αυτων ανδρες κυπριοι και κυρηναιοι οιτινες εισελθοντες εις αντιοχειαν ελαλουν προς τους ελληνιστας ευαγγελιζομενοι τον κυριον ιησουν
acts-of-the-apostles,11,21,και ην χειρ κυριου μετ αυτων πολυς τε αριθμος πιστευσας επεστρεψεν επι τον κυριον
acts-of-the-apostles,11,22,ηκουσθη δε ο λογος εις τα ωτα της εκκλησιας της εν ιεροσολυμοις περι αυτων και εξαπεστειλαν βαρναβαν διελθειν εως αντιοχειας
acts-of-the-apostles,11,23,ος παραγενομενος και ιδων την χαριν του θεου εχαρη και παρεκαλει παντας τη προθεσει της καρδιας προσμενειν τω κυριω
acts-of-the-apostles,11,24,οτι ην ανηρ αγαθος και πληρης πνευματος αγιου και πιστεως και προσετεθη οχλος ικανος τω κυριω
acts-of-the-apostles,11,25,εξηλθεν δε εις ταρσον ο βαρναβας αναζητησαι σαυλον
acts-of-the-apostles,11,26,και ευρων αυτον ηγαγεν αυτον εις αντιοχειαν εγενετο δε αυτους ενιαυτον ολον συναχθηναι εν τη εκκλησια και διδαξαι οχλον ικανον χρηματισαι τε πρωτον εν αντιοχεια τους μαθητας χριστιανους
acts-of-the-apostles,11,27,εν ταυταις δε ταις ημεραις κατηλθον απο ιεροσολυμων προφηται εις αντιοχειαν
acts-of-the-apostles,11,28,αναστας δε εις εξ αυτων ονοματι αγαβος εσημανεν δια του πνευματος λιμον μεγαν μελλειν εσεσθαι εφ ολην την οικουμενην οστις και εγενετο επι κλαυδιου καισαρος
acts-of-the-apostles,11,29,των δε μαθητων καθως ηυπορειτο τις ωρισαν εκαστος αυτων εις διακονιαν πεμψαι τοις κατοικουσιν εν τη ιουδαια αδελφοις
acts-of-the-apostles,11,30,ο και εποιησαν αποστειλαντες προς τους πρεσβυτερους δια χειρος βαρναβα και σαυλου
acts-of-the-apostles,12,1,κατ εκεινον δε τον καιρον επεβαλεν ηρωδης ο βασιλευς τας χειρας κακωσαι τινας των απο της εκκλησιας
acts-of-the-apostles,12,2,ανειλεν δε ιακωβον τον αδελφον ιωαννου μαχαιρα
acts-of-the-apostles,12,3,και ιδων οτι αρεστον εστιν τοις ιουδαιοις προσεθετο συλλαβειν και πετρον ησαν δε ημεραι των αζυμων
acts-of-the-apostles,12,4,ον και πιασας εθετο εις φυλακην παραδους τεσσαρσιν τετραδιοις στρατιωτων φυλασσειν αυτον βουλομενος μετα το πασχα αναγαγειν αυτον τω λαω
acts-of-the-apostles,12,5,ο μεν ουν πετρος ετηρειτο εν τη φυλακη προσευχη δε ην εκτενης γινομενη υπο της εκκλησιας προς τον θεον υπερ αυτου
acts-of-the-apostles,12,6,οτε δε εμελλεν αυτον προαγειν ο ηρωδης τη νυκτι εκεινη ην ο πετρος κοιμωμενος μεταξυ δυο στρατιωτων δεδεμενος αλυσεσιν δυσιν φυλακες τε προ της θυρας ετηρουν την φυλακην
acts-of-the-apostles,12,7,και ιδου αγγελος κυριου επεστη και φως ελαμψεν εν τω οικηματι παταξας δε την πλευραν του πετρου ηγειρεν αυτον λεγων αναστα εν ταχει και εξεπεσον αυτου αι αλυσεις εκ των χειρων
acts-of-the-apostles,12,8,ειπεν τε ο αγγελος προς αυτον περιζωσαι και υποδησαι τα σανδαλια σου εποιησεν δε ουτως και λεγει αυτω περιβαλου το ιματιον σου και ακολουθει μοι
acts-of-the-apostles,12,9,και εξελθων ηκολουθει αυτω και ουκ ηδει οτι αληθες εστιν το γινομενον δια του αγγελου εδοκει δε οραμα βλεπειν
acts-of-the-apostles,12,10,διελθοντες δε πρωτην φυλακην και δευτεραν ηλθον επι την πυλην την σιδηραν την φερουσαν εις την πολιν ητις αυτοματη ηνοιχθη αυτοις και εξελθοντες προηλθον ρυμην μιαν και ευθεως απεστη ο αγγελος απ αυτου
acts-of-the-apostles,12,11,και ο πετρος γενομενος εν εαυτω ειπεν νυν οιδα αληθως οτι εξαπεστειλεν κυριος τον αγγελον αυτου και εξειλετο με εκ χειρος ηρωδου και πασης της προσδοκιας του λαου των ιουδαιων
acts-of-the-apostles,12,12,συνιδων τε ηλθεν επι την οικιαν μαριας της μητρος ιωαννου του επικαλουμενου μαρκου ου ησαν ικανοι συνηθροισμενοι και προσευχομενοι
acts-of-the-apostles,12,13,κρουσαντος δε του πετρου την θυραν του πυλωνος προσηλθεν παιδισκη υπακουσαι ονοματι ροδη
acts-of-the-apostles,12,14,και επιγνουσα την φωνην του πετρου απο της χαρας ουκ ηνοιξεν τον πυλωνα εισδραμουσα δε απηγγειλεν εσταναι τον πετρον προ του πυλωνος
acts-of-the-apostles,12,15,οι δε προς αυτην ειπον μαινη η δε διισχυριζετο ουτως εχειν οι δ ελεγον ο αγγελος αυτου εστιν
acts-of-the-apostles,12,16,ο δε πετρος επεμενεν κρουων ανοιξαντες δε ειδον αυτον και εξεστησαν
acts-of-the-apostles,12,17,κατασεισας δε αυτοις τη χειρι σιγαν διηγησατο αυτοις πως ο κυριος αυτον εξηγαγεν εκ της φυλακης ειπεν δε απαγγειλατε ιακωβω και τοις αδελφοις ταυτα και εξελθων επορευθη εις ετερον τοπον
acts-of-the-apostles,12,18,γενομενης δε ημερας ην ταραχος ουκ ολιγος εν τοις στρατιωταις τι αρα ο πετρος εγενετο
acts-of-the-apostles,12,19,ηρωδης δε επιζητησας αυτον και μη ευρων ανακρινας τους φυλακας εκελευσεν απαχθηναι και κατελθων απο της ιουδαιας εις την καισαρειαν διετριβεν
acts-of-the-apostles,12,20,ην δε ο ηρωδης θυμομαχων τυριοις και σιδωνιοις ομοθυμαδον δε παρησαν προς αυτον και πεισαντες βλαστον τον επι του κοιτωνος του βασιλεως ητουντο ειρηνην δια το τρεφεσθαι αυτων την χωραν απο της βασιλικης
acts-of-the-apostles,12,21,τακτη δε ημερα ο ηρωδης ενδυσαμενος εσθητα βασιλικην και καθισας επι του βηματος εδημηγορει προς αυτους
acts-of-the-apostles,12,22,ο δε δημος επεφωνει θεου φωνη και ουκ ανθρωπου
acts-of-the-apostles,12,23,παραχρημα δε επαταξεν αυτον αγγελος κυριου ανθ ων ουκ εδωκεν την δοξαν τω θεω και γενομενος σκωληκοβρωτος εξεψυξεν
acts-of-the-apostles,12,24,ο δε λογος του θεου ηυξανεν και επληθυνετο
acts-of-the-apostles,12,25,βαρναβας δε και σαυλος υπεστρεψαν εξ ιερουσαλημ πληρωσαντες την διακονιαν συμπαραλαβοντες και ιωαννην τον επικληθεντα μαρκον
acts-of-the-apostles,13,1,ησαν δε τινες εν αντιοχεια κατα την ουσαν εκκλησιαν προφηται και διδασκαλοι ο τε βαρναβας και συμεων ο καλουμενος νιγερ και λουκιος ο κυρηναιος μαναην τε ηρωδου του τετραρχου συντροφος και σαυλος
acts-of-the-apostles,13,2,λειτουργουντων δε αυτων τω κυριω και νηστευοντων ειπεν το πνευμα το αγιον αφορισατε δη μοι τον τε βαρναβαν και τον σαυλον εις το εργον ο προσκεκλημαι αυτους
acts-of-the-apostles,13,3,τοτε νηστευσαντες και προσευξαμενοι και επιθεντες τας χειρας αυτοις απελυσαν
acts-of-the-apostles,13,4,ουτοι μεν ουν εκπεμφθεντες υπο του πνευματος του αγιου κατηλθον εις την σελευκειαν εκειθεν τε απεπλευσαν εις την κυπρον
acts-of-the-apostles,13,5,και γενομενοι εν σαλαμινι κατηγγελλον τον λογον του θεου εν ταις συναγωγαις των ιουδαιων ειχον δε και ιωαννην υπηρετην
acts-of-the-apostles,13,6,διελθοντες δε την νησον αχρι παφου ευρον τινα μαγον ψευδοπροφητην ιουδαιον ω ονομα βαριησους
acts-of-the-apostles,13,7,ος ην συν τω ανθυπατω σεργιω παυλω ανδρι συνετω ουτος προσκαλεσαμενος βαρναβαν και σαυλον επεζητησεν ακουσαι τον λογον του θεου
