book,chapter,verse,text
matthew,1,1,βιβλος γενεσεως ιησου χριστου υιου δαβιδ υιου αβρααμ
matthew,1,2,αβρααμ εγεννησεν τον ισαακ ισαακ δε εγεννησεν τον ιακωβ ιακωβ δε εγεννησεν τον ιουδαν και τους αδελφους αυτου
matthew,1,3,ιουδας δε εγεννησεν τον φαρες και τον ζαρα εκ της θαμαρ φαρες δε εγεννησεν τον εσρωμ εσρωμ δε εγεννησεν τον αραμ
matthew,1,4,αραμ δε εγεννησεν τον αμιναδαβ αμιναδαβ δε εγεννησεν τον ναασσων ναασσων δε εγεννησεν τον σαλμων
matthew,1,5,σαλμων δε εγεννησεν τον βοοζ εκ της ραχαβ βοοζ δε εγεννησεν τον ωβηδ εκ της ρουθ ωβηδ δε εγεννησεν τον ιεσσαι
matthew,1,6,ιεσσαι δε εγεννησεν τον δαβιδ τον βασιλεα δαβιδ δε ο βασιλευς εγεννησεν τον σολομωντα εκ της του ουριου
matthew,1,7,σολομων δε εγεννησεν τον ροβοαμ ροβοαμ δε εγεννησεν τον αβια αβια δε εγεννησεν τον ασα
matthew,1,8,ασα δε εγεννησεν τον ιωσαφατ ιωσαφατ δε εγεννησεν τον ιωραμ ιωραμ δε εγεννησεν τον οζιαν
matthew,1,9,οζιας δε εγεννησεν τον ιωαθαμ ιωαθαμ δε εγεννησεν τον αχαζ αχαζ δε εγεννησεν τον εζεκιαν
matthew,1,10,εζεκιας δε εγεννησεν τον μανασση μανασσης δε εγεννησεν τον αμων αμων δε εγεννησεν τον ιωσιαν
matthew,1,11,ιωσιας δε εγεννησεν τον ιεχονιαν και τους αδελφους αυτου επι της μετοικεσιας βαβυλωνος
matthew,1,12,μετα δε την μετοικεσιαν βαβυλωνος ιεχονιας εγεννησεν τον σαλαθιηλ σαλαθιηλ δε εγεννησεν τον ζοροβαβελ
matthew,1,13,ζοροβαβελ δε εγεννησεν τον αβιουδ αβιουδ δε εγεννησεν τον ελιακειμ ελιακειμ δε εγεννησεν τον αζωρ
matthew,1,14,αζωρ δε εγεννησεν τον σαδωκ σαδωκ δε εγεννησεν τον αχειμ αχειμ δε εγεννησεν τον ελιουδ
matthew,1,15,ελιουδ δε εγεννησεν τον ελεαζαρ ελεαζαρ δε εγεννησεν τον ματθαν ματθαν δε εγεννησεν τον ιακωβ
matthew,1,16,ιακωβ δε εγεννησεν τον ιωσηφ τον ανδρα μαριας εξ ης εγεννηθη ιησους ο λεγομενος χριστος
matthew,1,17,πασαι ουν αι γενεαι απο αβρααμ εως δαβιδ γενεαι δεκατεσσαρες και απο δαβιδ εως της μετοικεσιας βαβυλωνος γενεαι δεκατεσσαρες και απο της μετοικεσιας βαβυλωνος εως του χριστου γενεαι δεκατεσσαρες
matthew,1,18,του δε ιησου χριστου η γεννησις ουτως ην μνηστευθεισης γαρ της μητρος αυτου μαριας τω ιωσηφ πριν η συνελθειν αυτους ευρεθη εν γαστρι εχουσα εκ πνευματος αγιου
matthew,1,19,ιωσηφ δε ο ανηρ αυτης δικαιος ων και μη θελων αυτην παραδειγματισαι εβουληθη λαθρα απολυσαι αυτην
matthew,1,20,ταυτα δε αυτου ενθυμηθεντος ιδου αγγελος κυριου κατ οναρ εφανη αυτω λεγων ιωσηφ υιος δαβιδ μη φοβηθης παραλαβειν μαριαμ την γυναικα σου το γαρ εν αυτη γεννηθεν εκ πνευματος εστιν αγιου
matthew,1,21,τεξεται δε υιον και καλεσεις το ονομα αυτου ιησουν αυτος γαρ σωσει τον λαον αυτου απο των αμαρτιων αυτων
matthew,1,22,τουτο δε ολον γεγονεν ινα πληρωθη το ρηθεν υπο του κυριου δια του προφητου λεγοντος
matthew,1,23,ιδου η παρθενος εν γαστρι εξει και τεξεται υιον και καλεσουσιν το ονομα αυτου εμμανουηλ ο εστιν μεθερμηνευομενον μεθ ημων ο θεος
matthew,1,24,διεγερθεις δε ο ιωσηφ απο του υπνου εποιησεν ως προσεταξεν αυτω ο αγγελος κυριου και παρελαβεν την γυναικα αυτου
matthew,1,25,και ουκ εγινωσκεν αυτην εως ου ετεκεν τον υιον αυτης τον πρωτοτοκον και εκαλεσεν το ονομα αυτου ιησουν
matthew,2,1,του δε ιησου γεννηθεντος εν βηθλεεμ της ιουδαιας εν ημεραις ηρωδου του βασιλεως ιδου μαγοι απο ανατολων παρεγενοντο εις ιεροσολυμα
matthew,2,2,λεγοντες που εστιν ο τεχθεις βασιλευς των ιουδαιων ειδομεν γαρ αυτου τον αστερα εν τη ανατολη και ηλθομεν προσκυνησαι αυτω
matthew,2,3,ακουσας δε ηρωδης ο βασιλευς εταραχθη και πασα ιεροσολυμα μετ αυτου
matthew,2,4,και συναγαγων παντας τους αρχιερεις και γραμματεις του λαου επυνθανετο παρ αυτων που ο χριστος γενναται
matthew,2,5,οι δε ειπον αυτω εν βηθλεεμ της ιουδαιας ουτως γαρ γεγραπται δια του προφητου
matthew,2,6,και συ βηθλεεμ γη ιουδα ουδαμως ελαχιστη ει εν τοις ηγεμοσιν ιουδα εκ σου γαρ εξελευσεται ηγουμενος οστις ποιμανει τον λαον μου τον ισραηλ
matthew,2,7,τοτε ηρωδης λαθρα καλεσας τους μαγους ηκριβωσεν παρ αυτων τον χρονον του φαινομενου αστερος
matthew,2,8,και πεμψας αυτους εις βηθλεεμ ειπεν πορευθεντες ακριβως εξετασατε περι του παιδιου επαν δε ευρητε απαγγειλατε μοι οπως καγω ελθων προσκυνησω αυτω
matthew,2,9,οι δε ακουσαντες του βασιλεως επορευθησαν και ιδου ο αστηρ ον ειδον εν τη ανατολη προηγεν αυτους εως ελθων εστη επανω ου ην το παιδιον
matthew,2,10,ιδοντες δε τον αστερα εχαρησαν χαραν μεγαλην σφοδρα
matthew,2,11,και ελθοντες εις την οικιαν το παιδιον μετα μαριας της μητρος αυτου και πεσοντες προσεκυνησαν αυτω και ανοιξαντες τους θησαυρους αυτων προσηνεγκαν αυτω δωρα χρυσον και λιβανον και σμυρναν
matthew,2,12,και χρηματισθεντες κατ οναρ μη ανακαμψαι προς ηρωδην δι αλλης οδου ανεχωρησαν εις την χωραν αυτων
matthew,2,13,αναχωρησαντων δε αυτων ιδου αγγελος κυριου φαινεται κατ οναρ τω ιωσηφ λεγων εγερθεις παραλαβε το παιδιον και την μητερα αυτου και φευγε εις αιγυπτον και ισθι εκει εως αν ειπω σοι μελλει γαρ ηρωδης ζητειν το παιδιον του απολεσαι αυτο
matthew,2,14,ο δε εγερθεις παρελαβεν το παιδιον και την μητερα αυτου νυκτος και ανεχωρησεν εις αιγυπτον
matthew,2,15,και ην εκει εως της τελευτης ηρωδου ινα πληρωθη το ρηθεν υπο του κυριου δια του προφητου λεγοντος εξ αιγυπτου εκαλεσα τον υιον μου
matthew,2,16,τοτε ηρωδης ιδων οτι ενεπαιχθη υπο των μαγων εθυμωθη λιαν και αποστειλας ανειλεν παντας τους παιδας τους εν βηθλεεμ και εν πασιν τοις οριοις αυτης απο διετους και κατωτερω κατα τον χρονον ον ηκριβωσεν παρα των μαγων
matthew,2,17,τοτε επληρωθη το ρηθεν υπο ιερεμιου του προφητου λεγοντος
matthew,2,18,φωνη εν ραμα ηκουσθη θρηνος και κλαυθμος και οδυρμος πολυς ραχηλ κλαιουσα τα τεκνα αυτης και ουκ ηθελεν παρακληθηναι οτι ουκ εισιν
matthew,2,19,τελευτησαντος δε του ηρωδου ιδου αγγελος κυριου κατ οναρ φαινεται τω ιωσηφ εν αιγυπτω
matthew,2,20,λεγων εγερθεις παραλαβε το παιδιον και την μητερα αυτου και πορευου εις γην ισραηλ τεθνηκασιν γαρ οι ζητουντες την ψυχην του παιδιου
matthew,2,21,ο δε εγερθεις παρελαβεν το παιδιον και την μητερα αυτου και ηλθεν εις γην ισραηλ
matthew,2,22,ακουσας δε οτι αρχελαος βασιλευει επι της ιουδαιας αντι ηρωδου του πατρος αυτου εφοβηθη εκει απελθειν χρηματισθεις δε κατ οναρ ανεχωρησεν εις τα μερη της γαλιλαιας
matthew,2,23,και ελθων κατωκησεν εις πολιν λεγομενην οπως πληρωθη το ρηθεν δια των προφητων οτι ναζωραιος κληθησεται
matthew,3,1,εν δε ταις ημεραις εκειναις παραγινεται ιωαννης ο βαπτιστης κηρυσσων εν τη ερημω της ιουδαιας
matthew,3,2,και λεγων μετανοειτε ηγγικεν γαρ η βασιλεια των ουρανων
matthew,3,3,ουτος γαρ εστιν ο ρηθεις υπο ησαιου του προφητου λεγοντος φωνη βοωντος εν τη ερημω ετοιμασατε την οδον κυριου ευθειας ποιειτε τας τριβους αυτου
matthew,3,4,αυτος δε ο ιωαννης ειχεν το ενδυμα αυτου απο τριχων καμηλου και ζωνην δερματινην περι την οσφυν αυτου η δε τροφη αυτου ην ακριδες και μελι αγριον
matthew,3,5,τοτε εξεπορευετο προς αυτον ιεροσολυμα και πασα η ιουδαια και πασα η περιχωρος του ιορδανου
matthew,3,6,και εβαπτιζοντο εν τω ιορδανη υπ αυτου εξομολογουμενοι τας αμαρτιας αυτων
matthew,3,7,ιδων δε πολλους των φαρισαιων και σαδδουκαιων ερχομενους επι το βαπτισμα αυτου ειπεν αυτοις γεννηματα εχιδνων τις υπεδειξεν υμιν φυγειν απο της μελλουσης οργης
matthew,3,8,ποιησατε ουν καρπους αξιους της μετανοιας
matthew,3,9,και μη δοξητε λεγειν εν εαυτοις πατερα εχομεν τον αβρααμ λεγω γαρ υμιν οτι δυναται ο θεος εκ των λιθων τουτων εγειραι τεκνα τω αβρααμ
matthew,3,10,ηδη δε και η αξινη προς την ριζαν των δενδρων κειται παν ουν δενδρον μη ποιουν καρπον καλον εκκοπτεται και εις πυρ βαλλεται
matthew,3,11,εγω μεν βαπτιζω υμας εν υδατι εις μετανοιαν ο δε οπισω μου ερχομενος ισχυροτερος μου εστιν ου ουκ ειμι ικανος τα υποδηματα βαστασαι αυτος υμας βαπτισει εν πνευματι αγιω και πυρι
matthew,3,12,ου το πτυον εν τη χειρι αυτου και διακαθαριει την αλωνα αυτου και συναξει τον σιτον αυτου εις την αποθηκην το δε αχυρον κατακαυσει πυρι ασβεστω
matthew,3,13,τοτε παραγινεται ο ιησους απο της γαλιλαιας επι τον ιορδανην προς τον ιωαννην του βαπτισθηναι υπ αυτου
matthew,3,14,ο δε ιωαννης διεκωλυεν αυτον λεγων εγω χρειαν εχω υπο σου βαπτισθηναι και συ ερχη προς με
matthew,3,15,αποκριθεις δε ο ιησους ειπεν προς αυτον αφες αρτι ουτως γαρ πρεπον εστιν ημιν πληρωσαι πασαν δικαιοσυνην τοτε αφιησιν αυτον
matthew,3,16,και βαπτισθεις ο ιησους ανεβη ευθυς απο του υδατος και ιδου ανεωχθησαν αυτω οι ουρανοι και ειδεν το πνευμα του θεου καταβαινον ωσει περιστεραν και ερχομενον επ αυτον
matthew,3,17,και ιδου φωνη εκ των ουρανων λεγουσα ουτος εστιν ο υιος μου ο αγαπητος εν ω ευδοκησα
matthew,4,1,τοτε ο ιησους ανηχθη εις την ερημον υπο του πνευματος πειρασθηναι υπο του διαβολου
matthew,4,2,και νηστευσας ημερας τεσσαρακοντα και νυκτας τεσσαρακοντα υστερον επεινασεν
matthew,4,3,και προσελθων αυτω ο πειραζων ειπεν ει υιος ει του θεου ειπε ινα οι λιθοι ουτοι αρτοι γενωνται
matthew,4,4,ο δε αποκριθεις ειπεν γεγραπται ουκ επ αρτω μονω ζησεται ανθρωπος αλλ επι παντι ρηματι εκπορευομενω δια στοματος θεου
matthew,4,5,τοτε παραλαμβανει αυτον ο διαβολος εις την αγιαν πολιν και ιστησιν αυτον επι το πτερυγιον του ιερου
matthew,4,6,και λεγει αυτω ει υιος ει του θεου βαλε σεαυτον κατω γεγραπται γαρ οτι τοις αγγελοις αυτου εντελειται περι σου και επι χειρων αρουσιν σε μηποτε προσκοψης προς λιθον τον ποδα σου
matthew,4,7,εφη αυτω ο ιησους παλιν γεγραπται ουκ εκπειρασεις κυριον τον θεον σου
matthew,4,8,παλιν παραλαμβανει αυτον ο διαβολος εις ορος υψηλον λιαν και δεικνυσιν αυτω πασας τας βασιλειας του κοσμου και την δοξαν αυτων
matthew,4,9,και λεγει αυτω ταυτα παντα σοι δωσω εαν πεσων προσκυνησης μοι
matthew,4,10,τοτε λεγει αυτω ο ιησους υπαγε σατανα γεγραπται γαρ κυριον τον θεον σου προσκυνησεις και αυτω μονω λατρευσεις
matthew,4,11,τοτε αφιησιν αυτον ο διαβολος και ιδου αγγελοι προσηλθον και διηκονουν αυτω
matthew,4,12,ακουσας δε ο ιησους οτι ιωαννης παρεδοθη ανεχωρησεν εις την γαλιλαιαν
matthew,4,13,και καταλιπων την ελθων κατωκησεν εις καπερναουμ την παραθαλασσιαν εν οριοις ζαβουλων και νεφθαλειμ
matthew,4,14,ινα πληρωθη το ρηθεν δια ησαιου του προφητου λεγοντος
matthew,4,15,γη ζαβουλων και γη νεφθαλειμ οδον θαλασσης περαν του ιορδανου γαλιλαια των εθνων
matthew,4,16,ο λαος ο καθημενος εν σκοτει ειδε φως μεγα και τοις καθημενοις εν χωρα και σκια θανατου φως ανετειλεν αυτοις
matthew,4,17,απο τοτε ηρξατο ο ιησους κηρυσσειν και λεγειν μετανοειτε ηγγικεν γαρ η βασιλεια των ουρανων
matthew,4,18,περιπατων δε ο ιησους παρα την θαλασσαν της γαλιλαιας ειδεν δυο αδελφους σιμωνα τον λεγομενον πετρον και ανδρεαν τον αδελφον αυτου βαλλοντας αμφιβληστρον εις την θαλασσαν ησαν γαρ αλιεις
matthew,4,19,και λεγει αυτοις δευτε οπισω μου και ποιησω υμας αλιεις ανθρωπων
matthew,4,20,οι δε ευθεως αφεντες τα δικτυα ηκολουθησαν αυτω
matthew,4,21,και προβας εκειθεν ειδεν αλλους δυο αδελφους ιακωβον τον του ζεβεδαιου και ιωαννην τον αδελφον αυτου εν τω πλοιω μετα ζεβεδαιου του πατρος αυτων καταρτιζοντας τα δικτυα αυτων και εκαλεσεν αυτους
matthew,4,22,οι δε ευθεως αφεντες το πλοιον και τον πατερα αυτων ηκολουθησαν αυτω
matthew,4,23,και περιηγεν ολην την γαλιλαιαν ο ιησους διδασκων εν ταις συναγωγαις αυτων και κηρυσσων το ευαγγελιον της βασιλειας και θεραπευων πασαν νοσον και πασαν μαλακιαν εν τω λαω
matthew,4,24,και απηλθεν η ακοη αυτου εις ολην την συριαν και προσηνεγκαν αυτω παντας τους κακως εχοντας ποικιλαις νοσοις και βασανοις συνεχομενους και δαιμονιζομενους και σεληνιαζομενους και παραλυτικους και εθεραπευσεν αυτους
matthew,4,25,και ηκολουθησαν αυτω οχλοι πολλοι απο της γαλιλαιας και δεκαπολεως και ιεροσολυμων και ιουδαιας και περαν του ιορδανου
matthew,5,1,ιδων δε τους οχλους ανεβη εις το ορος και καθισαντος αυτου προσηλθον αυτω οι μαθηται αυτου
matthew,5,2,και ανοιξας το στομα αυτου εδιδασκεν αυτους λεγων
matthew,5,3,μακαριοι οι πτωχοι τω πνευματι οτι αυτων εστιν η βασιλεια των ουρανων
matthew,5,4,μακαριοι οι πενθουντες οτι αυτοι παρακληθησονται
matthew,5,5,μακαριοι οι πραεις οτι αυτοι κληρονομησουσιν την γην
matthew,5,6,μακαριοι οι πεινωντες και διψωντες την δικαιοσυνην οτι αυτοι χορτασθησονται
matthew,5,7,μακαριοι οι ελεημονες οτι αυτοι ελεηθησονται
matthew,5,8,μακαριοι οι καθαροι τη καρδια οτι αυτοι τον θεον οψονται
matthew,5,9,μακαριοι οι ειρηνοποιοι οτι αυτοι υιοι θεου κληθησονται
matthew,5,10,μακαριοι οι δεδιωγμενοι ενεκεν δικαιοσυνης οτι αυτων εστιν η βασιλεια των ουρανων
matthew,5,11,μακαριοι εστε οταν ονειδισωσιν υμας και διωξωσιν και ειπωσιν παν πονηρον ρημα καθ υμων ψευδομενοι ενεκεν εμου
matthew,5,12,χαιρετε και αγαλλιασθε οτι ο μισθος υμων πολυς εν τοις ουρανοις ουτως γαρ εδιωξαν τους προφητας τους προ υμων
matthew,5,13,υμεις εστε το αλας της γης εαν δε το αλας μωρανθη εν τινι αλισθησεται εις ουδεν ισχυει ετι ει μη βληθηναι εξω και καταπατεισθαι υπο των ανθρωπων
matthew,5,14,υμεις εστε το φως του κοσμου ου δυναται πολις κρυβηναι επανω ορους κειμενη
matthew,5,15,ουδε καιουσιν λυχνον και τιθεασιν αυτον υπο τον μοδιον αλλ επι την λυχνιαν και λαμπει πασιν τοις εν τη οικια
matthew,5,16,ουτως λαμψατω το φως υμων εμπροσθεν των ανθρωπων οπως ιδωσιν υμων τα καλα εργα και δοξασωσιν τον πατερα υμων τον εν τοις ουρανοις
matthew,5,17,μη νομισητε οτι ηλθον καταλυσαι τον νομον η τους προφητας ουκ ηλθον καταλυσαι αλλα πληρωσαι
matthew,5,18,αμην γαρ λεγω υμιν εως αν παρελθη ο ουρανος και η γη ιωτα εν η μια κεραια ου μη παρελθη απο του νομου εως αν παντα γενηται
matthew,5,19,ος εαν ουν λυση μιαν των εντολων τουτων των ελαχιστων και διδαξη ουτως τους ανθρωπους ελαχιστος κληθησεται εν τη βασιλεια των ουρανων ος δ αν ποιηση και διδαξη ουτος μεγας κληθησεται εν τη βασιλεια των ουρανων
matthew,5,20,λεγω γαρ υμιν οτι εαν μη περισσευση η δικαιοσυνη υμων πλειον των γραμματεων και φαρισαιων ου μη εισελθητε εις την βασιλειαν των ουρανων
matthew,5,21,ηκουσατε οτι ερρεθη τοις αρχαιοις ου φονευσεις ος δ αν φονευση ενοχος εσται τη κρισει
matthew,5,22,εγω δε λεγω υμιν οτι πας ο οργιζομενος τω αδελφω αυτου εικη ενοχος εσται τη κρισει ος δ αν ειπη τω αδελφω αυτου ρακα ενοχος εσται τω συνεδριω ος δ αν ειπη μωρε ενοχος εσται εις την γεενναν του πυρος
matthew,5,23,εαν ουν προσφερης το δωρον σου επι το θυσιαστηριον κακει μνησθης οτι ο αδελφος σου εχει τι κατα σου
matthew,5,24,αφες εκει το δωρον σου εμπροσθεν του θυσιαστηριου και υπαγε πρωτον διαλλαγηθι τω αδελφω σου και τοτε ελθων προσφερε το δωρον σου
matthew,5,25,ισθι ευνοων τω αντιδικω σου ταχυ εως οτου ει εν τη οδω μετ αυτου μηποτε σε παραδω ο αντιδικος τω κριτη και ο κριτης σε παραδω τω υπηρετη και εις φυλακην βληθηση
matthew,5,26,αμην λεγω σοι ου μη εξελθης εκειθεν εως αν αποδως τον εσχατον κοδραντην
matthew,5,27,ηκουσατε οτι ερρεθη τοις αρχαιοις ου μοιχευσεις
matthew,5,28,εγω δε λεγω υμιν οτι πας ο βλεπων γυναικα προς το επιθυμησαι αυτης ηδη εμοιχευσεν αυτην εν τη καρδια αυτου
matthew,5,29,ει δε ο οφθαλμος σου ο δεξιος σκανδαλιζει σε εξελε αυτον και βαλε απο σου συμφερει γαρ σοι ινα αποληται εν των μελων σου και μη ολον το σωμα σου βληθη εις γεενναν
matthew,5,30,και ει η δεξια σου χειρ σκανδαλιζει σε εκκοψον αυτην και βαλε απο σου συμφερει γαρ σοι ινα αποληται εν των μελων σου και μη ολον το σωμα σου βληθη εις γεενναν
matthew,5,31,ερρεθη δε οτι ος αν απολυση την γυναικα αυτου δοτω αυτη αποστασιον
